{
  "$schema": "http://json-schema.org/draft-07/schema#",
  "title": "HelioGrid QA report",
  "type": "object",
  "required": ["run_id", "summary", "passes", "failures", "inconclusive"],
  "additionalProperties": false,
  "properties": {
    "run_id": { "type": "string" },
    "summary": {
      "type": "object",
      "required": ["total", "pass", "fail", "inconclusive"],
      "additionalProperties": false,
      "properties": {
        "total": { "type": "integer" },
        "pass": { "type": "integer" },
        "fail": { "type": "integer" },
        "inconclusive": { "type": "integer" }
      }
    },
    "passes": { "type": "array", "items": { "type": "string" } },
    "failures": {
      "type": "array",
      "items": {
        "type": "object",
        "required": ["id", "surface", "quadrant", "steps_run", "expected", "actual", "artifacts"],
        "additionalProperties": false,
        "properties": {
          "id": { "type": "string" },
          "surface": { "enum": ["web", "api", "db", "ios", "android"] },
          "quadrant": { "enum": ["happy", "edge", "negative", "adversarial"] },
          "steps_run": { "type": "array", "items": { "type": "string" } },
          "expected": { "type": "string" },
          "actual": { "type": "string" },
          "artifacts": { "type": "array", "items": { "type": "string" }, "minItems": 1 }
        }
      }
    },
    "inconclusive": {
      "type": "array",
      "items": {
        "type": "object",
        "required": ["id", "why"],
        "additionalProperties": false,
        "properties": { "id": { "type": "string" }, "why": { "type": "string" } }
      }
    }
  }
}
