{
  "run_id": "2026-08-02-1058",
  "summary": { "total": 12, "pass": 12, "fail": 0, "inconclusive": 0 },
  "passes": [
    "WEB-PAT-001", "WEB-PAT-002", "WEB-PAT-003", "WEB-PAT-004",
    "IOS-PAT-001", "IOS-PAT-002", "IOS-PAT-003", "IOS-PAT-004",
    "AND-PAT-001", "AND-PAT-002", "AND-PAT-003", "AND-PAT-004"
  ],
  "failures": [],
  "inconclusive": []
}
