{
  "run_id": "2026-08-02-0011",
  "summary": {
    "total": 23,
    "pass": 20,
    "fail": 0,
    "inconclusive": 3
  },
  "passes": [
    "WEB-LOGIN-001",
    "WEB-LOGIN-002",
    "WEB-EDGE-003",
    "WEB-EDGE-004",
    "WEB-NEG-005",
    "WEB-NEG-006",
    "WEB-ADV-007",
    "WEB-ADV-008",
    "API-HAPPY-009",
    "API-EDGE-010",
    "API-NEG-011",
    "API-ADV-012",
    "IOS-HAPPY-013",
    "IOS-EDGE-014",
    "IOS-NEG-015",
    "IOS-ADV-016",
    "AND-HAPPY-017",
    "AND-EDGE-018",
    "AND-NEG-019",
    "AND-ADV-020"
  ],
  "failures": [],
  "inconclusive": [
    {
      "id": "CORE-TENANCY-021",
      "why": "BLOCKED. Cross-tenant isolation CANNOT be exercised: packages/db is greenfield (ADR-0024) so there are zero application tables and no tenants to isolate. The observed table count is 1 (schema_migrations)."
    },
    {
      "id": "CORE-MONEY-022",
      "why": "BLOCKED. Money reconciliation (BOM ↔ proposal ↔ tranches) has no surface in this slice: no money endpoints, screens or tables exist yet."
    },
    {
      "id": "CORE-AUTH-023",
      "why": "BLOCKED. 'An unauthenticated request to a protected route is rejected' cannot be tested: there are no protected routes. The global deny-by-default SessionGuard was removed with auth (ADR-0024), so every route is currently public BY DESIGN."
    }
  ]
}
